{
  "schemaId": "contract.scenario_envelope.v0",
  "scenarioId": "scenario.space4x.contract_survivors_mvp.v0",
  "seed": 19031,
  "duration_s": 135,
  "contracts": {
    "mining": [
      "mining.space4x.survivors_lane_alpha.v0"
    ],
    "combat": [
      "combat.space4x.survivors_intercept_wave.v0"
    ],
    "roomProfiles": [
      "room.space4x.survivors_opening.v0"
    ],
    "missionObjectives": [
      "mission.space4x.escort_civilians_core.v0"
    ],
    "lootCaches": [
      "cache.space4x.salvage_stash_contested.v0"
    ],
    "encounters": [
      "encounter.space4x.raider_warlord_intro.v0"
    ]
  },
  "roomSequence": [
    {
      "roomId": "room.space4x.survivors_opening.v0",
      "start_s": 0
    }
  ],
  "actions": [
    {
      "time_s": 26,
      "kind": "trigger_intercept",
      "description": "friendly alpha intercepts first hostile wave"
    },
    {
      "time_s": 48,
      "kind": "reinforce_hostile_lane",
      "description": "second hostile pressure wave enters lower arc"
    }
  ]
}
